{
  "schema": "systems_hub.task_manifest/v1",
  "task_id": "security-exposure-review",
  "task_kind": "standard",
  "execution_status": "manual",
  "role": "security-officer",
  "scope": "company",
  "provider": "deepseek",
  "model": "deepseek-v4-pro",
  "source_root": ".",
  "context": {
    "allowed_files": [
      "agents/roles/security-officer.md",
      "operations/jobs/security-exposure-review.md",
      "governance/security.md",
      "governance/model-access.md",
      "company/operations/risk-register.md",
      "projects/traders-hub/security/risk-register.md",
      "projects/traders-hub/security/legal-status.md"
    ],
    "allowed_data_classes": ["internal", "protected"],
    "max_files": 9,
    "max_total_bytes": 196608,
    "provider_approval": "operations/approvals/provider-access/security-exposure-review-deepseek-v4-pro-2026-06-16.json"
  },
  "permissions": {
    "tools": ["read", "grep", "find", "ls"],
    "write": false,
    "external_actions": false
  },
  "budget": {
    "max_input_tokens": 18000,
    "max_output_tokens": 2600,
    "max_total_tokens": 28000,
    "max_cost_usd": 0.25
  },
  "prompt": "Draft a concise non-destructive security exposure review using only supplied approved evidence. Your first output characters must be exactly ## Scope. Do not write planning text, a preamble, a readiness statement, or any text before that heading. Use exactly these H2 headings and no others: Scope; Severity-Ranked Findings; Sanitized Evidence; Remediation; Verification Needed; Approval Needed; Evidence Quality. Do not expose secrets, claim tests were run when only documents were reviewed, exploit any target, change dependencies, or recommend production action without approval. In Approval Needed, include the exact word approval. Keep Severity-Ranked Findings to at most 6 bullets, Remediation to at most 6 bullets, Verification Needed to at most 6 bullets, and the full output under 850 words.",
  "output": {
    "format": "markdown",
    "max_words": 900,
    "required_sections": [
      "Scope",
      "Severity-Ranked Findings",
      "Sanitized Evidence",
      "Remediation",
      "Verification Needed",
      "Approval Needed",
      "Evidence Quality"
    ],
    "allow_preamble": false
  },
  "validation": {
    "forbidden_patterns": [
      "\\bexploited production\\b",
      "\\bthe secret value is\\b",
      "\\bthe credential is\\b"
    ],
    "required_patterns": ["High|Medium|Low", "approval", "verification"],
    "section_required_patterns": {
      "Scope": ["document|read-only|scope"],
      "Approval Needed": ["approval|none"]
    },
    "require_evidence_labels": true
  }
}
