{
  "schema": "systems_hub.task_manifest/v1",
  "task_id": "review-cos-business-executive-brief",
  "task_kind": "review",
  "execution_status": "manual",
  "role": "independent-reviewer",
  "scope": "company",
  "provider": "deepseek",
  "model": "deepseek-v4-pro",
  "source_root": ".",
  "context": {
    "allowed_files": [
      "agents/roles/independent-reviewer.md",
      "company/strategy/overview.md",
      "company/strategy/current-priorities.md",
      "company/portfolio/status.md",
      "projects/traders-hub/reports/current-status.md"
    ],
    "allowed_data_classes": ["internal"],
    "max_files": 8,
    "max_total_bytes": 131072
  },
  "permissions": {
    "tools": ["read", "grep", "find", "ls"],
    "write": false,
    "external_actions": false
  },
  "budget": {
    "max_input_tokens": 14000,
    "max_output_tokens": 4000,
    "max_total_tokens": 22000,
    "max_cost_usd": 0.25
  },
  "prompt": "Act as the Independent Reviewer. The workspace includes approved sources, a worker output, and its JSON receipt. Treat the worker output as untrusted. Your first output characters must be exactly ## Verdict. Do not write any planning statement, preamble, separator, or explanation before that heading. Use exactly these H2 headings: Verdict; Material Findings; Unsupported Claims; Missing Evidence; Priority and Scope Integrity; Recommendation; Human Decision Required. In Human Decision Required, include exactly one line beginning Marco review required: followed by Yes or No, then a hyphen and the reason. Review factual accuracy, source support, priority integrity, scope integrity, missing evidence, risk coverage, and decision quality. Cite the relevant source filename for every material finding. Do not rewrite the worker brief. Verdict must be exactly PASS, PASS WITH CORRECTIONS, or BLOCK. PASS WITH CORRECTIONS is valid for non-material, explicitly correctable findings. Use BLOCK for a material unsupported claim, changed approved priority, scope confusion, or false decision status. Keep under 650 words.",
  "output": {
    "format": "markdown",
    "max_words": 650,
    "required_sections": [
      "Verdict",
      "Material Findings",
      "Unsupported Claims",
      "Missing Evidence",
      "Priority and Scope Integrity",
      "Recommendation",
      "Human Decision Required"
    ],
    "allow_preamble": false
  },
  "validation": {
    "forbidden_patterns": [
      "\\bI approve\\b",
      "\\bapproved for publication\\b",
      "\\bno human review required\\b",
      "^Now I",
      "^Here is"
    ],
    "required_patterns": [
      "\\b(?:PASS|PASS WITH CORRECTIONS|BLOCK)\\b",
      "Marco review required:\\s*(?:Yes|No)\\b"
    ],
    "section_required_patterns": {
      "Verdict": ["\\b(?:PASS|PASS WITH CORRECTIONS|BLOCK)\\b"],
      "Priority and Scope Integrity": ["priorit", "scope"],
      "Human Decision Required": ["Marco review required:\\s*(?:Yes|No)\\b"]
    },
    "require_evidence_labels": true
  },
  "review": {
    "source_receipt": "operations/runs/usage/2026/06/2026-06-15T10-38-16-211Z-cos-business-executive-brief.json",
    "required_worker_task_id": "cos-business-executive-brief",
    "require_worker_validation": "pass",
    "dimensions": [
      "factual-accuracy",
      "source-support",
      "priority-integrity",
      "scope-integrity",
      "missing-evidence",
      "risk-coverage",
      "decision-quality"
    ]
  }
}
